{
  "run_metadata": {
    "schema_name": "poc-shops-schema-v1",
    "schema_version": "0.2.0-poc",
    "category_taxonomy_version": "poc-subset-0.3",
    "generated_at": "2026-09-04T00:00:00Z"
  },
  "product_type": "shops",
  "scope_decision_ref": "resolved:kotilaituri-hanko-shop",
  "fields": {
    "name": {
      "fi": {
        "status": "found",
        "value": "Sisustuskauppa Kotilaituri",
        "evidence": [
          {
            "source_id": "p002",
            "locator": "line 23",
            "excerpt": "Sisustuskauppa Kotilaituri",
            "quote_verified": true
          }
        ]
      },
      "en": {
        "status": "missing",
        "notes": "No English-language page or content was found on this site; all pages are in Finnish."
      }
    },
    "description": {
      "fi": {
        "status": "found",
        "value": "Kotilaiturin sisustuskaupassa on myynniss\u00e4 kattava valikoima sisustustuotteita, kuten DBKD, Ernst, Eva Solo, Gift Label, Lauritzon, Madam Stoltz, VM Carpet, Helatukku sek\u00e4 kuratoitu valikoima 50-80-luvun nordic vintage ja design tuotteita, -astioita, valaisimia sek\u00e4 kalusteita.",
        "evidence": [
          {
            "source_id": "p001",
            "locator": "line 16",
            "excerpt": "Kotilaiturin sisustuskaupassa on myynniss\u00e4 kattava valikoima sisustustuotteita, kuten DBKD, Ernst, Eva Solo, Gift Label, Lauritzon, Madam Stoltz, VM Carpet, Helatukku sek\u00e4 kuratoitu valikoima 50-80-luvun nordic vintage ja design tuotteita, -astioita, valaisimia sek\u00e4 kalusteita.",
            "quote_verified": true
          }
        ]
      },
      "en": {
        "status": "missing",
        "notes": "No English-language page or content was found on this site."
      }
    },
    "address": {
      "status": "found",
      "value": {
        "street": "Vuorikatu 13",
        "postal_code": "10900",
        "city": "Hanko"
      },
      "evidence": [
        {
          "source_id": "p002",
          "locator": "line 24",
          "excerpt": "Vuorikatu 13, 10900 HANKO",
          "quote_verified": true
        }
      ],
      "notes": "Country (Finland) and region are not explicitly stated on the page and are therefore omitted rather than inferred."
    },
    "coordinates": {
      "status": "missing"
    },
    "contact": {
      "status": "review",
      "value": {
        "phone": "040 7221 471",
        "email": "kotilaituri@gmail.com",
        "website": "https://www.kotilaituri.fi/"
      },
      "evidence": [
        {
          "source_id": "p002",
          "locator": "line 35",
          "excerpt": "p. 040 7221 471"
        },
        {
          "source_id": "p002",
          "locator": "line 36",
          "excerpt": "kotilaituri@gmail.com"
        },
        {
          "source_id": "p002",
          "locator": "line 43",
          "excerpt": "Kotilaituri -> https://www.kotilaituri.fi/"
        }
      ],
      "notes": "The contact page lists one phone number and one email under the registered business name 'Sisustussuunnittelu Kotilaituri' (Y-tunnus 1315969-4), directly beneath both the Hanko shop and Ilmarinen design-service addresses. No shop-specific phone/email is separately given, so this may be a shared company contact rather than a shop-only line; curator should verify which channel serves the shop."
    },
    "categories": {
      "status": "review",
      "value": [
        "other_shop"
      ],
      "evidence": [
        {
          "source_id": "p001",
          "locator": "line 16",
          "excerpt": "Kotilaiturin sisustuskaupassa on myynniss\u00e4 kattava valikoima sisustustuotteita, kuten DBKD, Ernst, Eva Solo, Gift Label, Lauritzon, Madam Stoltz, VM Carpet, Helatukku sek\u00e4 kuratoitu valikoima 50-80-luvun nordic vintage ja design tuotteita, -astioita, valaisimia sek\u00e4 kalusteita."
        }
      ],
      "alternatives": [
        {
          "value": [
            "boutique"
          ],
          "evidence": [
            {
              "source_id": "p001",
              "locator": "line 15",
              "excerpt": "Kotilaituri Nordic vintage design"
            }
          ],
          "reason": "The shop curates branded home-decor products alongside a selection of Nordic vintage/design items, which could also fit a small curated 'Boutique' classification instead of the generic 'Other Shop' label. No taxonomy entry specifically covers home-decor/interior shops, so this remains a curator judgement call."
        }
      ]
    },
    "accessibility": {
      "status": "missing"
    },
    "sustainability_label": {
      "status": "missing"
    },
    "stf_status": {
      "status": "missing"
    },
    "opening_hours": {
      "status": "review",
      "value": {
        "regular": [
          {
            "days": [
              "thursday",
              "friday"
            ],
            "opens": "11:00",
            "closes": "17:00",
            "notes": "Syys-talvikautena (autumn-winter season)"
          },
          {
            "days": [
              "saturday"
            ],
            "opens": "11:00",
            "closes": "15:00",
            "notes": "Syys-talvikautena (autumn-winter season)"
          }
        ],
        "notes": "Muina aikoina sopimuksesta (other times by appointment). Source also states a summer-season schedule (Juhannuksesta koulujen alkuun asti: MA-PE 11-17, LA 11-15, SU 12-15 hein\u00e4kuussa) that differs from the autumn-winter hours shown here; see alternatives. Exact calendar dates of the season boundary (Midsummer / start of school) are not stated."
      },
      "evidence": [
        {
          "source_id": "p002",
          "locator": "line 31",
          "excerpt": "TO-PE 11-17 | LA 11-15"
        },
        {
          "source_id": "p001",
          "locator": "line 20",
          "excerpt": "syys-talvikautena TO-PE 11-17 | LA 11-15, kes\u00e4ll\u00e4 MA-PE 11-17 | LA 11-15."
        },
        {
          "source_id": "p002",
          "locator": "line 32",
          "excerpt": "Muina aikoina sopimuksesta."
        }
      ],
      "alternatives": [
        {
          "value": {
            "regular": [
              {
                "days": [
                  "monday",
                  "tuesday",
                  "wednesday",
                  "thursday",
                  "friday"
                ],
                "opens": "11:00",
                "closes": "17:00"
              },
              {
                "days": [
                  "saturday"
                ],
                "opens": "11:00",
                "closes": "15:00"
              },
              {
                "days": [
                  "sunday"
                ],
                "opens": "12:00",
                "closes": "15:00",
                "notes": "Hein\u00e4kuussa (July only)"
              }
            ],
            "notes": "Summer season: Juhannuksesta koulujen alkuun asti (from Midsummer to start of school)."
          },
          "evidence": [
            {
              "source_id": "p002",
              "locator": "line 26",
              "excerpt": "Juhannuksesta koulujen alkuun asti"
            },
            {
              "source_id": "p002",
              "locator": "line 27",
              "excerpt": "MA-PE 11-17"
            },
            {
              "source_id": "p002",
              "locator": "line 28",
              "excerpt": "LA 11-15"
            },
            {
              "source_id": "p002",
              "locator": "line 29",
              "excerpt": "SU 12-15 (Hein\u00e4kuu)"
            }
          ],
          "reason": "Summer-season hours differ from the autumn-winter schedule chosen as the primary value; both are stated by the source but apply to different, not-precisely-dated parts of the year."
        }
      ]
    },
    "languages_spoken": {
      "status": "missing"
    },
    "images": {
      "status": "not_in_scope"
    }
  },
  "validation": {
    "valid": true,
    "errors": [],
    "warnings": []
  }
}